PROSHARES TR PSHS ULTSH 20YRS,TBT,Citadel Securities LLC,07-ene
PROSHARES TR SHORT BITCOIN,BITI,"Group One Trading, L.P.",08-ene
PROSHARES TR SHORT ETHER STRG,SETH,Belvedere Trading LLC,06-ene
PROSHARES TR SHORT QQQ NEW,PSQ,"Susquehanna Securities, LLC",07-ene
PROSHARES TR SHORT S&P 500 NE,SH,Citadel Securities LLC,03-ene
PROSHARES TR SHRT 20+YR TRE,TBF,Morgan Stanley & Co. LLC,02-ene
PROSHARES TR SHRT HGH YIELD,SJB,"Susquehanna Securities, LLC",07-ene
PROSHARES TR SHRT RL EST FD,REK,"Wolverine Trading, LLC",03-ene
PROSHARES TR SHRT RUSSELL2000,RWM,Belvedere Trading LLC,04-ene
PROSHARES TR SHRT SMALLCAP60,SBB,Belvedere Trading LLC,06-ene
PROSHARES TR SHT FTSE CHIN 50,YXI,Belvedere Trading LLC,05-ene
PROSHARES TR SHT MSCI NEW,EEV,Citadel Securities LLC,03-ene
PROSHARES TR SP500 EX FINLS,SPXN,Belvedere Trading LLC,02-ene
PROSHARES TR SP500 EX TECH,SPXT,Belvedere Trading LLC,01-ene
PROSHARES TR SUPPLY CHAIN LOG,SUPL,Belvedere Trading LLC,05-ene
PROSHARES TR UL MSCI JP ETF,EZJ,"Susquehanna Securities, LLC",07-ene
PROSHARES TR ULSH 20YRTRE NEW,TTT,"Susquehanna Securities, LLC",07-ene
PROSHARES TR ULSHRT SEMIC NEW,SSG,"Wolverine Trading, LLC",03-ene
PROSHARES TR ULSHRT TECH NEW,REW,"Wolverine Trading, LLC",08-ene
PROSHARES TR ULSHRT UTILS NEW,SDP,Belvedere Trading LLC,03-ene
PROSHARES TR ULT FTSE CHIN 50,XPP,Citadel Securities LLC,01-ene
PROSHARES TR ULT MSCI BR CAPP,BZQ,Citadel Securities LLC,01-ene
PROSHARES TR ULT R/EST NEW,URE,Citadel Securities LLC,03-ene
PROSHARES TR ULTPRO SHT,SMDD,Belvedere Trading LLC,01-ene
PROSHARES TR ULTPRO SHT 2017,SRTY,Belvedere Trading LLC,05-ene
PROSHARES TR ULTR 7-10 TREA,UST,"Susquehanna Securities, LLC",07-ene
PROSHARES TR ULTR NASDAQCMPTG,SKYU,Belvedere Trading LLC,06-ene
PROSHARES TR ULTR RUSSL2000,URTY,Belvedere Trading LLC,01-ene
PROSHARES TR ULTRA 20YR TRE,UBT,"Susquehanna Securities, LLC",07-ene
PROSHARES TR ULTRA COMMUNICTN,LTL,Belvedere Trading LLC,04-ene
PROSHARES TR ULTRA CYBRSCURTY,UCYB,Belvedere Trading LLC,01-ene
PROSHARES TR ULTRA ENERGY,DIG,Citadel Securities LLC,03-ene
PROSHARES TR ULTRA FNCLS NEW,UYG,Citadel Securities LLC,02-ene
PROSHARES TR ULTRA MATERIALS,UYM,Citadel Securities LLC,02-ene
PROSHARES TR ULTRAPRO QQQ,TQQQ,"Susquehanna Securities, LLC",01-ene
PROSHARES TR ULTRAPRO SHORT S,SPXU,Belvedere Trading LLC,06-ene
PROSHARES TR ULTRAPRO SHT QQQ,SQQQ,Optiver US LLC,06-ene
PROSHARES TR ULTRASHORT CONSM,SZK,Belvedere Trading LLC,04-ene
PROSHARES TR ULTRASHORT ENRGY,DUG,Citadel Securities LLC,05-ene
PROSHARES TR ULTRASHORT INDL,SIJ,Belvedere Trading LLC,05-ene
PROSHARES TR ULTRASHORT MATER,SMN,Citadel Securities LLC,05-ene
PROSHARES TR ULTRASHRT DOW 30,SDOW,Citadel Securities LLC,05-ene
PROSHARES TR ULTRASHRT S&P500,SDS,Citadel Securities LLC,07-ene
PROSHARES TR ULTRPRO DOW30,UDOW,Citadel Securities LLC,01-ene
PROSHARES TR ULTRPRO S&P500,UPRO,"IMC-Chicago, LLC dba IMC Financial Markets",02-ene
PROSHARES TR ULTSHRT QQQ,QID,Citadel Securities LLC,02-ene
PROSHARES TR ULTSHT FINLS NEW,SKF,Citadel Securities LLC,02-ene
PROSHARES TR ULTSHT FT CH 50,FXP,Citadel Securities LLC,03-ene
PROSHARES TR ULTSHT FTSE EURO,EPV,"Susquehanna Securities, LLC",03-ene
PROSHARES TR ULTSHT HLTHCRE,RXD,Belvedere Trading LLC,04-ene
PROSHARES TR ULTSHT MIDCAP400,MZZ,Citadel Securities LLC,03-ene
PROSHARES TR ULTSHT MSCI JAP,EWV,"Susquehanna Securities, LLC",07-ene
PROSHARES TR ULTSHT REAL EST,SRS,Citadel Securities LLC,03-ene
PROSHARES TR ULTSHT RUSS2000,TWM,Citadel Securities LLC,03-ene
PROSHARES TR ULTSHT SMLCP600,SDD,Belvedere Trading LLC,03-ene
PROSHARES TR ULTST NASD NW20,BIS,"Susquehanna Securities, LLC",07-ene
ProShares Ultra VIX Short-Term Futures ETF,UVXY,Morgan Stanley & Co. LLC,09-ene
ProShares VIX Mid-Term Futures ETF,VIXM,"Group One Trading, L.P.",09-ene
ProShares VIX Short-Term Futures ETF,VIXY,"Group One Trading, L.P.",09-ene
PROSPECT CAP CORP COM,PSEC,Citadel Securities LLC,03-ene
PROSPERITY BANCSHARES INC COM,PB,"Wolverine Trading, LLC",03-ene
PROTAGONIST THERAPEUTICS INC COM,PTGX,Belvedere Trading LLC,04-ene
PROTALIX BIOTHERAPEUTICS INC COM,PLX,"Group One Trading, L.P.",05-ene
PROTARA THERAPEUTICS INC COM STK,TARA,Belvedere Trading LLC,06-ene
PROTHENA CORP PLC SHS,PRTA,Citadel Securities LLC,05-ene
PROTO LABS INC COM,PRLB,"Susquehanna Securities, LLC",03-ene
PROVIDENT BANCORP INC COM NEW,PVBC,"Wolverine Trading, LLC",06-ene
PROVIDENT FINL SVCS INC COM,PFS,"Wolverine Trading, LLC",03-ene
PRUDENTIAL FINL INC COM,PRU,"Susquehanna Securities, LLC",04-ene
PSQ HOLDINGS INC CL A,PSQH,"Group One Trading, L.P.",01-ene
PTC INC COM,PTC,Morgan Stanley & Co. LLC,06-ene
PTC THERAPEUTICS INC COM,PTCT,"Susquehanna Securities, LLC",04-ene
PUBLIC STORAGE COM,PSA,"Susquehanna Securities, LLC",02-ene
PUBLIC SVC ENTERPRISE GRP INC COM,PEG,"Susquehanna Securities, LLC",02-ene
PUBMATIC INC COM CL A,PUBM,Citadel Securities LLC,04-ene
PULMONX CORP COM,LUNG,"Susquehanna Securities, LLC",05-ene
PULSE BIOSCIENCES INC COM,PLSE,Citadel Securities LLC,01-ene
PULTE GROUP INC COM,PHM,Citadel Securities LLC,06-ene
PUMA BIOTECHNOLOGY INC COM,PBYI,"Susquehanna Securities, LLC",01-ene
PURE STORAGE INC CL A,PSTG,Citadel Securities LLC,05-ene
PURECYCLE TECHNOLOGIES INC COM,PCT,Citadel Securities LLC,01-ene
PURPLE BIOTECH LTD SPONSORED ADS,PPBT,Belvedere Trading LLC,04-ene
PURPLE INNOVATION INC COM,PRPL,"Wolverine Trading, LLC",04-ene
PVH CORPORATION COM,PVH,Citadel Securities LLC,03-ene
PYROGENESIS CDA INC COM,PYRGF,"Wolverine Trading, LLC",03-ene
Q2 HLDGS INC COM,QTWO,Citadel Securities LLC,04-ene
QIAGEN NV SHS NEW,QGEN,"Susquehanna Securities, LLC",01-ene
QIFU TECHNOLOGY INC AMERICAN DEP,QFIN,"Susquehanna Securities, LLC",01-ene
QORVO INC COM,QRVO,"Susquehanna Securities, LLC",03-ene
QUAD / GRAPHICS INC COM CL A,QUAD,"Susquehanna Securities, LLC",03-ene
QUAKER HOUGHTON COM,KWR,"Group One Trading, L.P.",04-ene
QUALCOMM INC COM,QCOM,"Susquehanna Securities, LLC",06-ene
QUALYS INC COM,QLYS,"Susquehanna Securities, LLC",02-ene
QUANEX BLDG PRODS CORP COM,NX,"Susquehanna Securities, LLC",04-ene
QUANTA SVCS INC COM,PWR,Citadel Securities LLC,01-ene
QUANTERIX CORP COM,QTRX,"Wolverine Trading, LLC",03-ene
QUANTUM COMPUTING INC COM,QUBT,"Susquehanna Securities, LLC",06-ene
QUANTUM SI INC COM CL A,QSI,Belvedere Trading LLC,06-ene
QUANTUMSCAPE CORP COM CL A,QS,"Wolverine Trading, LLC",03-ene
QUDIAN INC ADR,QD,"Wolverine Trading, LLC",03-ene
QUEST DIAGNOSTICS INC COM,DGX,"Two Sigma Securities, LLC",06-ene
QUEST RESOURCE HLDG CORP COM NEW,QRHC,"Wolverine Trading, LLC",03-ene
QUICKLOGIC CORP COM NEW,QUIK,"Wolverine Trading, LLC",02-ene
QUIDELORTHO CORP COM,QDEL,"Susquehanna Securities, LLC",06-ene
QUINCE THERAPEUTICS INC COM,QNCX,"Susquehanna Securities, LLC",01-ene
QUINSTREET INC COM,QNST,"Wolverine Trading, LLC",03-ene
QUIPT HOME MEDICAL CORP COM,QIPT,"Wolverine Trading, LLC",03-ene
QURATE RETAIL INC COM SER A,QRTEA,"Susquehanna Securities, LLC",03-ene
R1 RCM INC COM,RCM,Citadel Securities LLC,01-ene
RACKSPACE TECHNOLOGY INC COM,RXT,Citadel Securities LLC,02-ene
RADIAN GROUP INC COM,RDN,Morgan Stanley & Co. LLC,01-ene
RADIANT LOGISTICS INC COM,RLGT,"Susquehanna Securities, LLC",02-ene
RADIUS RECYCLING INC CL A,RDUS,Morgan Stanley & Co. LLC,01-ene
RADNET INC COM,RDNT,Belvedere Trading LLC,06-ene
RADWARE LTD ORD,RDWR,Belvedere Trading LLC,06-ene
RAFAEL HLDGS INC COM CL B,RFL,"Wolverine Trading, LLC",03-ene
RALPH LAUREN CORP CL A,RL,Citadel Securities LLC,05-ene
RAMACO RES INC COM CL A,METC,"Group One Trading, L.P.",04-ene
RAMBUS INC DEL COM,RMBS,"Susquehanna Securities, LLC",04-ene
RANGE RES CORP COM,RRC,Citadel Securities LLC,04-ene
RANGER ENERGY SVCS INC COM CL A,RNGR,"Susquehanna Securities, LLC",01-ene
RANI THERAPEUTICS HLDGS INC COM CL A,RANI,Belvedere Trading LLC,03-ene
RANPAK HOLDINGS CORP COM CL A,PACK,"Group One Trading, L.P.",04-ene
RAPID7 INC COM,RPD,"Wolverine Trading, LLC",02-ene
RAPT THERAPEUTICS INC COM,RAPT,"Susquehanna Securities, LLC",01-ene
RAVE RESTAURANT GROUP INC COM,RAVE,Citadel Securities LLC,01-ene
RAYMOND JAMES FINL INC COM,RJF,"Wolverine Trading, LLC",06-ene
RAYONIER ADVANCED MATLS INC COM,RYAM,Citadel Securities LLC,03-ene
RAYONIER INC COM,RYN,Citadel Securities LLC,01-ene
RB GLOBAL INC COM,RBA,"Susquehanna Securities, LLC",03-ene
RBB FD INC US TREAS 20YR BD,UTWY,Belvedere Trading LLC,05-ene
RBB FD INC US TREAS 30YR BD,UTHY,Belvedere Trading LLC,04-ene
RBB FD INC US TRSRY 6 MNTH,XBIL,Belvedere Trading LLC,04-ene
RBC BEARINGS INC COM,RBC,"Wolverine Trading, LLC",03-ene
RCI HOSPITALITY HLDGS INC COM,RICK,"Susquehanna Securities, LLC",05-ene
RE MAX HLDGS INC CL A,RMAX,Citadel Securities LLC,04-ene
READING INTL INC CL A,RDI,Belvedere Trading LLC,01-ene
READY CAPITAL CORP COM,RC,"Wolverine Trading, LLC",03-ene
Real Estate Select Sector Index S&P 500,SIXRE,"Susquehanna Securities, LLC",07-ene
REALTY INCOME CORP COM,O,"Wolverine Trading, LLC",03-ene
RECON TECHNOLOGY LTD CL A SHS,RCON,"Susquehanna Securities, LLC",04-ene
RECURSION PHARMACEUTICALS INC CL A,RXRX,Citadel Securities LLC,01-ene
RED CAT HLDGS INC COM,RCAT,"Susquehanna Securities, LLC",02-ene
RED ROBIN GOURMET BURGERS INC COM,RRGB,Morgan Stanley & Co. LLC,02-ene
RED ROCK RESORTS INC CL A,RRR,Morgan Stanley & Co. LLC,04-ene
REDFIN CORP COM,RDFN,Morgan Stanley & Co. LLC,05-ene
REDWIRE CORPORATION COM,RDW,"Wolverine Trading, LLC",03-ene
REDWOOD TRUST INC COM,RWT,Citadel Securities LLC,03-ene
REE AUTOMOTIVE LTD SHS CL A NEW,REE,Belvedere Trading LLC,02-ene
REGAL REXNORD CORPORATION COM,RRX,"Susquehanna Securities, LLC",04-ene
REGENCY CTRS CORP COM,REG,"Susquehanna Securities, LLC",05-ene
REGENERON PHARMACEUTICALS COM,REGN,"Wolverine Trading, LLC",06-ene
Regents Park Hedged Market Strategy ETF,RPHS,Belvedere Trading LLC,06-ene
REGENXBIO INC COM,RGNX,Citadel Securities LLC,03-ene
REGIONAL MGMT CORP COM,RM,"Wolverine Trading, LLC",03-ene
REGIONS FINANCIAL CORP NEW COM,RF,"Susquehanna Securities, LLC",02-ene
REGULUS THERAPEUTICS INC COM,RGLS,"Susquehanna Securities, LLC",04-ene
REINSURANCE GRP OF AMERICA INC COM NEW,RGA,Morgan Stanley & Co. LLC,01-ene
REKOR SYSTEMS INC COM,REKR,"Wolverine Trading, LLC",03-ene
RELAY THERAPEUTICS INC COM,RLAY,"Susquehanna Securities, LLC",02-ene
RELIANCE INC COM,RS,Citadel Securities LLC,04-ene
RELMADA THERAPEUTICS INC COM,RLMD,"Group One Trading, L.P.",04-ene
RELX PLC SPONSORED ADR,RELX,Citadel Securities LLC,03-ene
REMARK HLDGS INC COM NEW,MARK,Citadel Securities LLC,06-ene
REMITLY GLOBAL INC COM,RELY,Citadel Securities LLC,01-ene
RENAISSANCE CAP GREENWICH FDS INTNTL IPO ETF,IPOS,"Group One Trading, L.P.",04-ene
RENAISSANCE CAP GREENWICH FDS IPO ETF,IPO,Belvedere Trading LLC,03-ene
RENAISSANCERE HLDGS LTD COM,RNR,Morgan Stanley & Co. LLC,06-ene
RENALYTIX PLC ADS,RNLX,Citadel Securities LLC,06-ene
RENASANT CORP COM,RNST,Citadel Securities LLC,02-ene
RENEO PHARMACEUTICALS INC COM,RPHM,Belvedere Trading LLC,02-ene
RENEW ENERGY GLOBAL PLC CL A SHS,RNW,"Wolverine Trading, LLC",03-ene
RENOVARO INC COM,RENB,Belvedere Trading LLC,02-ene
RENT THE RUNWAY INC COM CL A,RENT,"Wolverine Trading, LLC",03-ene
RENTOKIL INITIAL PLC SPONSORED ADR,RTO,Citadel Securities LLC,01-ene
REPARE THERAPEUTICS INC COM,RPTX,Citadel Securities LLC,02-ene
REPAY HLDGS CORP COM CL A,RPAY,Citadel Securities LLC,05-ene
REPLIGEN CORP COM,RGEN,Citadel Securities LLC,05-ene
REPLIMUNE GROUP INC COM,REPL,Citadel Securities LLC,05-ene
REPOSITRAK INC COM NEW,TRAK,"Wolverine Trading, LLC",02-ene
REPUBLIC FIRST BANCORP INC COM,FRBK,"Wolverine Trading, LLC",03-ene
REPUBLIC SVCS INC COM,RSG,Citadel Securities LLC,02-ene
RESEARCH FRONTIERS INC COM,REFR,"Wolverine Trading, LLC",03-ene
RESERVOIR MEDIA INC COM,RSVR,Belvedere Trading LLC,04-ene
Residential REIT ETF,HAUS,Belvedere Trading LLC,01-ene
RESIDEO TECHNOLOGIES INC COM,REZI,"Wolverine Trading, LLC",03-ene
RESMED INC COM,RMD,"Susquehanna Securities, LLC",03-ene
RESOURCES CONNECTION INC COM,RGP,"Susquehanna Securities, LLC",02-ene
RESTAURANT BRANDS INTL INC COM,QSR,Citadel Securities LLC,03-ene
RETAIL OPPORTUNITY INVTS CORP COM,ROIC,Citadel Securities LLC,02-ene
RETRACTABLE TECHNOLOGIES INC COM,RVP,Citadel Securities LLC,05-ene
REV GROUP INC COM,REVG,"Wolverine Trading, LLC",02-ene
REVANCE THERAPEUTICS INC COM,RVNC,"Group One Trading, L.P.",04-ene
REVIVA PHARMACEUTCLS HLDGS INC COM,RVPH,"Susquehanna Securities, LLC",02-ene
REVOLUTION MEDICINES INC COM,RVMD,"Group One Trading, L.P.",04-ene
REVOLVE GROUP INC CL A,RVLV,Citadel Securities LLC,06-ene
REVVITY INC COM,RVTY,"Susquehanna Securities, LLC",06-ene
REWALK ROBOTICS LTD SHS,LFWD,"Susquehanna Securities, LLC",06-ene
REX AMERICAN RES CORP COM,REX,Belvedere Trading LLC,06-ene
REXFORD INDL RLTY INC COM,REXR,"Wolverine Trading, LLC",03-ene
REYNOLDS CONSUMER PRODS INC COM,REYN,Citadel Securities LLC,01-ene
RH COM,RH,"Wolverine Trading, LLC",05-ene
RHYTHM PHARMACEUTICALS INC COM,RYTM,Citadel Securities LLC,01-ene
RIBBON COMMUNICATIONS INC COM,RBBN,"Wolverine Trading, LLC",03-ene
RICHARDSON ELECTRS LTD COM,RELL,Citadel Securities LLC,03-ene
RIGEL PHARMACEUTICALS INC COM NEW,RIGL,"Susquehanna Securities, LLC",05-ene
RIGETTI COMPUTING INC COMMON STOCK,RGTI,"Group One Trading, L.P.",04-ene
RILEY EXPLORATION PERMIAN INC COM,REPX,Belvedere Trading LLC,04-ene
RIMINI STR INC DEL COM,RMNI,"Wolverine Trading, LLC",03-ene
RING ENERGY INC COM,REI,Belvedere Trading LLC,01-ene
RINGCENTRAL INC CL A,RNG,"Wolverine Trading, LLC",03-ene
RIO TINTO PLC SPONSORED ADR,RIO,"Susquehanna Securities, LLC",02-ene
RIOT PLATFORMS INC COM,RIOT,"Susquehanna Securities, LLC",06-ene
RISKIFIED LTD SHS CL A,RSKD,"Susquehanna Securities, LLC",03-ene
RITHM CAPITAL CORP COM NEW,RITM,Morgan Stanley & Co. LLC,04-ene
RIVERVIEW BANCORP INC COM,RVSB,Citadel Securities LLC,04-ene
RIVIAN AUTOMOTIVE INC COM CL A,RIVN,Citadel Securities LLC,06-ene
RLI CORP COM,RLI,"Susquehanna Securities, LLC",01-ene
RLJ LODGING TR COM,RLJ,"Wolverine Trading, LLC",05-ene
RLX TECHNOLOGY INC SPONSORED ADS,RLX,Citadel Securities LLC,01-ene
RMR GROUP INC CL A,RMR,Citadel Securities LLC,05-ene
ROBERT HALF INC. COM,RHI,Citadel Securities LLC,06-ene
ROBINHOOD MKTS INC COM CL A,HOOD,Citadel Securities LLC,02-ene
ROBLOX CORP CL A,RBLX,Citadel Securities LLC,01-ene
ROCKET COS INC COM CL A,RKT,Citadel Securities LLC,03-ene
ROCKET LAB USA INC COM,RKLB,"Susquehanna Securities, LLC",03-ene
ROCKET PHARMACEUTICALS INC COM,RCKT,Citadel Securities LLC,02-ene
ROCKWELL AUTOMATION INC COM,ROK,"Wolverine Trading, LLC",03-ene
ROCKWELL MED INC COM NEW,RMTI,"Wolverine Trading, LLC",06-ene
ROGERS COMMUNICATIONS INC CL B,RCI,"Wolverine Trading, LLC",03-ene
ROGERS CORP COM,ROG,Citadel Securities LLC,01-ene
ROIVANT SCIENCES LTD SHS,ROIV,"Susquehanna Securities, LLC",06-ene
ROKU INC COM CL A,ROKU,Morgan Stanley & Co. LLC,06-ene
ROLLINS INC COM,ROL,"Wolverine Trading, LLC",03-ene
ROPER TECHNOLOGIES INC COM,ROP,"Susquehanna Securities, LLC",01-ene
ROSS STORES INC COM,ROST,Citadel Securities LLC,05-ene
Roundhill Bitcoin Covered Call Strategy ETF,YBTC,"Group One Trading, L.P.",08-ene
Roundhill Cannabis ETF,WEED,Belvedere Trading LLC,02-ene
ROYAL BK CDA COM,RY,"Two Sigma Securities, LLC",06-ene
ROYAL CARIBBEAN GROUP COM,RCL,Citadel Securities LLC,06-ene
ROYAL GOLD INC COM,RGLD,"Group One Trading, L.P.",04-ene
ROYALTY PHARMA PLC SHS CLASS A,RPRX,Citadel Securities LLC,04-ene
RPC INC COM,RES,"Group One Trading, L.P.",04-ene
RPM INTL INC COM,RPM,"Wolverine Trading, LLC",06-ene
RTX CORPORATION COM,RTX,"Susquehanna Securities, LLC",03-ene
RUBICON TECHNOLOGIES INC CL A,RBT,Belvedere Trading LLC,02-ene
RUMBLE INC COM CL A,RUM,"Susquehanna Securities, LLC",06-ene
RUMBLEON INC COM CL B,RMBL,"Group One Trading, L.P.",04-ene
RUNWAY GROWTH FINANCE CORP COM,RWAY,Belvedere Trading LLC,05-ene
RUSH ENTERPRISES INC CL A,RUSHA,Belvedere Trading LLC,05-ene
RUSH STREET INTERACTIVE INC COM,RSI,Belvedere Trading LLC,06-ene
Russell 1000 Index,RUI,"Susquehanna Securities, LLC",07-ene
Russell 1000 Value Index,RLV,"Susquehanna Securities, LLC",07-ene
Russell 2000 Index,RUT,"Susquehanna Securities, LLC",07-ene
RVL PHARMACEUTICALS PLC SHS,RVLPQ,Belvedere Trading LLC,01-ene
RXO INC COMMON STOCK,RXO,Citadel Securities LLC,04-ene
RXSIGHT INC COM,RXST,Belvedere Trading LLC,04-ene
RYANAIR HOLDINGS PLC SPONSORED ADS,RYAAY,"Wolverine Trading, LLC",03-ene
RYDER SYS INC COM,R,"Susquehanna Securities, LLC",03-ene
RYERSON HLDG CORP COM,RYI,Citadel Securities LLC,02-ene
RYMAN HOSPITALITY PPTYS INC COM,RHP,"Susquehanna Securities, LLC",01-ene
RYVYL INC COM,RVYL,"Wolverine Trading, LLC",03-ene
S&P 100 index American-style,OEX,Citadel Securities LLC,05-ene
S&P 100 index European-style,XEO,Citadel Securities LLC,05-ene
S&P 500 ESG Index,SPESG,,09-ene
S&P GLOBAL INC COM,SPGI,Morgan Stanley & Co. LLC,03-ene
S&W SEED CO COM,SANW,Citadel Securities LLC,04-ene
SABRA HEALTH CARE REIT INC COM,SBRA,Belvedere Trading LLC,01-ene
SABRE CORP COM,SABR,"Wolverine Trading, LLC",05-ene
SACHEM CAP CORP COM,SACH,"Group One Trading, L.P.",04-ene
SAFE & GREEN HOLDINGS CORP COM NEW,SGBX,Citadel Securities LLC,04-ene
SAFE BULKERS INC COM,SB,Morgan Stanley & Co. LLC,04-ene
SAFEHOLD INC COM,SAFE,"Group One Trading, L.P.",04-ene
SAFETY INS GROUP INC COM,SAFT,"Wolverine Trading, LLC",03-ene
SAFETY SHOT INC COM NEW,SHOT,Morgan Stanley & Co. LLC,02-ene
SAGE THERAPEUTICS INC COM,SAGE,"Susquehanna Securities, LLC",04-ene
SAIA INC COM,SAIA,"Susquehanna Securities, LLC",06-ene
SALESFORCE INC COM,CRM,Citadel Securities LLC,05-ene
SALLY BEAUTY HLDGS INC COM,SBH,"Susquehanna Securities, LLC",02-ene
SAMSARA INC COM CL A,IOT,"Susquehanna Securities, LLC",06-ene
SAN JUAN BASIN RTY TR UNIT BEN INT,SJT,"Susquehanna Securities, LLC",03-ene
SANA BIOTECHNOLOGY INC COM,SANA,Citadel Securities LLC,02-ene
SANDRIDGE ENERGY INC COM NEW,SD,"Wolverine Trading, LLC",02-ene
SANDSTORM GOLD LTD COM NEW,SAND,"Susquehanna Securities, LLC",04-ene
SANFILIPPO JOHN B & SON INC COM,JBSS,"Susquehanna Securities, LLC",01-ene
SANGAMO THERAPEUTICS INC COM,SGMO,"Wolverine Trading, LLC",03-ene
SANMINA CORPORATION COM,SANM,Citadel Securities LLC,06-ene
SANOFI SPONSORED ADR,SNY,Citadel Securities LLC,02-ene
SAP SE SPON ADR,SAP,Citadel Securities LLC,05-ene
SAPIENS INTL CORP N V SHS,SPNS,"Susquehanna Securities, LLC",06-ene
SARATOGA INVT CORP COM NEW,SAR,"Wolverine Trading, LLC",03-ene
SAREPTA THERAPEUTICS INC COM,SRPT,"Group One Trading, L.P.",04-ene
SASOL LTD SPONSORED ADR,SSL,Citadel Securities LLC,02-ene
SATELLOGIC INC CLASS A ORD SHS,SATL,Belvedere Trading LLC,03-ene
SAUL CTRS INC COM,BFS,"Wolverine Trading, LLC",03-ene
SAVARA INC COM,SVRA,"Susquehanna Securities, LLC",02-ene
SBA COMMUNICATIONS CORP NEW CL A,SBAC,Citadel Securities LLC,02-ene
SCANSOURCE INC COM,SCSC,"Susquehanna Securities, LLC",02-ene
SCHLUMBERGER LTD COM STK,SLB,Citadel Securities LLC,02-ene
SCHNEIDER NATIONAL INC CL B,SNDR,"Susquehanna Securities, LLC",01-ene
SCHOLAR ROCK HLDG CORP COM,SRRK,Citadel Securities LLC,05-ene
SCHOLASTIC CORP COM,SCHL,"Wolverine Trading, LLC",01-ene
SCHRODINGER INC COM,SDGR,"Susquehanna Securities, LLC",03-ene
SCHWAB CHARLES CORP COM,SCHW,Citadel Securities LLC,02-ene
SCHWAB STRATEGIC TR 1000 INDEX ETF,SCHK,Belvedere Trading LLC,03-ene
SCHWAB STRATEGIC TR EMRG MKTEQ ETF,SCHE,"Susquehanna Securities, LLC",07-ene
SCHWAB STRATEGIC TR INT-TRM U.S TRES,SCHR,Belvedere Trading LLC,03-ene
SCHWAB STRATEGIC TR INTL EQTY ETF,SCHF,"Susquehanna Securities, LLC",07-ene
SCHWAB STRATEGIC TR INTL SCEQT ETF,SCHC,"Wolverine Trading, LLC",08-ene
SCHWAB STRATEGIC TR SCHWAB FDT US LG,FNDX,Belvedere Trading LLC,02-ene
SCHWAB STRATEGIC TR SCHWAB FDT US SC,FNDA,Belvedere Trading LLC,02-ene
SCHWAB STRATEGIC TR SCHWB FDT EMK LG,FNDE,Belvedere Trading LLC,03-ene
SCHWAB STRATEGIC TR SCHWB FDT INT LG,FNDF,Belvedere Trading LLC,06-ene
SCHWAB STRATEGIC TR SHT TM US TRES,SCHO,Citadel Securities LLC,02-ene
SCHWAB STRATEGIC TR US AGGREGATE B,SCHZ,Belvedere Trading LLC,06-ene
SCHWAB STRATEGIC TR US BRD MKT ETF,SCHB,"Susquehanna Securities, LLC",07-ene
SCHWAB STRATEGIC TR US DIVIDEND EQ,SCHD,"Susquehanna Securities, LLC",07-ene
SCHWAB STRATEGIC TR US LCAP GR ETF,SCHG,"Susquehanna Securities, LLC",07-ene
SCHWAB STRATEGIC TR US LCAP VA ETF,SCHV,"Susquehanna Securities, LLC",07-ene
SCHWAB STRATEGIC TR US LRG CAP ETF,SCHX,"Susquehanna Securities, LLC",07-ene
SCHWAB STRATEGIC TR US MID-CAP ETF,SCHM,"Susquehanna Securities, LLC",07-ene
SCHWAB STRATEGIC TR US REIT ETF,SCHH,"Susquehanna Securities, LLC",07-ene
SCHWAB STRATEGIC TR US SML CAP ETF,SCHA,"Susquehanna Securities, LLC",07-ene
SCHWAB STRATEGIC TR US TIPS ETF,SCHP,"Susquehanna Securities, LLC",07-ene
SCIENCE APPLICATIONS INTL CORP COM,SAIC,"Susquehanna Securities, LLC",03-ene
SCILEX HOLDING CO COM,SCLX,"Group One Trading, L.P.",03-ene
SCORPIO TANKERS INC SHS,STNG,"Wolverine Trading, LLC",03-ene
SCORPIUS HOLDINGS INC COM,SCPX,Citadel Securities LLC,05-ene
SCOTTS MIRACLE-GRO CO CL A,SMG,"Susquehanna Securities, LLC",03-ene
SCPHARMACEUTICALS INC COM,SCPH,Belvedere Trading LLC,02-ene
SCRIPPS E W CO OHIO CL A NEW,SSP,Belvedere Trading LLC,04-ene
SCULLY ROYALTY LTD COM SHS,SRL,Belvedere Trading LLC,02-ene
SCYNEXIS INC COM NEW,SCYX,"Susquehanna Securities, LLC",03-ene
SEA LTD SPONSORD ADS,SE,Citadel Securities LLC,05-ene
SEABRIDGE GOLD INC COM,SA,Citadel Securities LLC,03-ene
SEACOAST BKG CORP FLA COM NEW,SBCF,Citadel Securities LLC,03-ene
SEACOR MARINE HLDGS INC COM,SMHI,"Group One Trading, L.P.",04-ene
SEADRILL 2021 LTD COM,SDRL,"Wolverine Trading, LLC",03-ene
SEAGATE TECHNOLOGY HLDNGS PLC ORD SHS,STX,"Susquehanna Securities, LLC",01-ene
SEALED AIR CORP NEW COM,SEE,"Two Sigma Securities, LLC",06-ene
SEANERGY MARITIME HLDGS CORP SHS,SHIP,"Wolverine Trading, LLC",03-ene
SECUREWORKS CORP CL A,SCWX,"Susquehanna Securities, LLC",03-ene
SEELOS THERAPEUTICS INC COM NEW,SEEL,Belvedere Trading LLC,01-ene
SEER INC COM CL A,SEER,"Susquehanna Securities, LLC",03-ene
SEI INVTS CO COM,SEIC,Citadel Securities LLC,05-ene
SELECT MED HLDGS CORP COM,SEM,"Susquehanna Securities, LLC",02-ene
SELECT SECTOR SPDR TR COMMUNICATION,XLC,Citadel Securities LLC,04-ene
SELECT SECTOR SPDR TR ENERGY,XLE,Optiver US LLC,06-ene
SELECT SECTOR SPDR TR FINANCIAL,XLF,"Susquehanna Securities, LLC",06-ene
SELECT SECTOR SPDR TR INDL,XLI,Morgan Stanley & Co. LLC,05-ene
SELECT SECTOR SPDR TR RL EST SEL SEC,XLRE,Citadel Securities LLC,03-ene
SELECT SECTOR SPDR TR SBI CONS DISCR,XLY,Morgan Stanley & Co. LLC,05-ene
SELECT SECTOR SPDR TR SBI CONS STPLS,XLP,"Two Sigma Securities, LLC",06-ene
SELECT SECTOR SPDR TR SBI HEALTHCARE,XLV,"Two Sigma Securities, LLC",06-ene
SELECT SECTOR SPDR TR SBI INT-UTILS,XLU,"Two Sigma Securities, LLC",06-ene
SELECT SECTOR SPDR TR SBI MATERIALS,XLB,"Two Sigma Securities, LLC",06-ene
SELECT SECTOR SPDR TR TECHNOLOGY,XLK,"Two Sigma Securities, LLC",06-ene
SELECT WATER SOLUTIONS INC CL A COM,WTTR,"Wolverine Trading, LLC",03-ene
SELECTIVE INS GROUP INC COM,SIGI,"Wolverine Trading, LLC",05-ene
SELECTQUOTE INC COM,SLQT,"Wolverine Trading, LLC",03-ene
SELLAS LIFE SCIENCES GROUP INC COM NEW,SLS,Citadel Securities LLC,06-ene
SEMPRA COM,SRE,Citadel Securities LLC,02-ene
SEMRUSH HLDGS INC CL A COM,SEMR,Citadel Securities LLC,03-ene
SEMTECH CORP COM,SMTC,"Susquehanna Securities, LLC",02-ene
SENDAS DISTRIBUIDORA S A SPON ADS,ASAI,Belvedere Trading LLC,03-ene
SENSATA TECHNOLOGIES HLDG PLC SHS,ST,Morgan Stanley & Co. LLC,05-ene
SENSEONICS HLDGS INC COM,SENS,"Susquehanna Securities, LLC",03-ene
SENSIENT TECHNOLOGIES CORP COM,SXT,Citadel Securities LLC,06-ene
SENSUS HEALTHCARE INC COM,SRTS,Citadel Securities LLC,01-ene
SENTINELONE INC CL A,S,"Susquehanna Securities, LLC",02-ene
SERES THERAPEUTICS INC COM,MCRB,"Group One Trading, L.P.",04-ene
SERITAGE GROWTH PPTYS CL A,SRG,Citadel Securities LLC,03-ene
SERVICE CORP INTL COM,SCI,"Wolverine Trading, LLC",03-ene
SERVICE PPTYS TR COM SH BEN INT,SVC,"Susquehanna Securities, LLC",06-ene
SERVICENOW INC COM,NOW,"Susquehanna Securities, LLC",03-ene
SERVISFIRST BANCSHARES INC COM,SFBS,Citadel Securities LLC,04-ene
SES AI CORPORATION CL A COM,SES,Citadel Securities LLC,05-ene
SEVEN HILLS REALTY TRUST COM,SEVN,Belvedere Trading LLC,01-ene
SFL CORPORATION LTD SHS,SFL,"Susquehanna Securities, LLC",03-ene
SHAKE SHACK INC CL A,SHAK,Morgan Stanley & Co. LLC,05-ene
SHARECARE INC COM CL A,SHCR,"Group One Trading, L.P.",04-ene
SHARKNINJA INC COM SHS,SN,Morgan Stanley & Co. LLC,03-ene
SHATTUCK LABS INC COM,STTK,Citadel Securities LLC,01-ene
SHELL PLC SPON ADS,SHEL,Citadel Securities LLC,03-ene
SHENANDOAH TELECOMMUNICATIONS COM,SHEN,"Susquehanna Securities, LLC",02-ene
SHERWIN WILLIAMS CO COM,SHW,"Wolverine Trading, LLC",05-ene
SHIFT4 PMTS INC CL A,FOUR,"Wolverine Trading, LLC",03-ene
SHINHAN FINANCIAL GROUP CO LTD SPN ADR RESTRD,SHG,Citadel Securities LLC,05-ene
SHOALS TECHNOLOGIES GROUP INC CL A,SHLS,"Susquehanna Securities, LLC",03-ene
SHOCKWAVE MED INC COM,SWAV,"Wolverine Trading, LLC",03-ene
SHOE CARNIVAL INC COM,SCVL,"Wolverine Trading, LLC",03-ene
SHOPIFY INC CL A,SHOP,"Susquehanna Securities, LLC",03-ene
SHUTTERSTOCK INC COM,SSTK,"Wolverine Trading, LLC",03-ene
SHYFT GROUP INC COM,SHYF,"Susquehanna Securities, LLC",05-ene
SI-BONE INC COM,SIBN,Citadel Securities LLC,05-ene
SIBANYE STILLWATER LTD SPONSORED ADR,SBSW,"Susquehanna Securities, LLC",01-ene
SIENTRA INC COM,SIENQ,"Wolverine Trading, LLC",02-ene
SIERRA BANCORP COM,BSRR,"Susquehanna Securities, LLC",04-ene
SIFY TECHNOLOGIES LTD SPONSORED ADS,SIFY,"Wolverine Trading, LLC",02-ene
SIGA TECHNOLOGIES INC COM,SIGA,"Group One Trading, L.P.",04-ene
SIGHT SCIENCES INC COM,SGHT,"Group One Trading, L.P.",04-ene
SIGMA ADDITIVE SOLUTIONS INC COM NEW,SASI,Belvedere Trading LLC,01-ene
SIGMA LITHIUM CORPORATION COM,SGML,Citadel Securities LLC,01-ene
